lesson_no,question_no,type,question,correct_letters,correct_answers,option_a,option_b,option_c,option_d
"2","30","single",". Elton Mayo đã thực hiện nghiên cứu nội dung gì?","B","B.Ảnh hưởng của ánh sáng nơi làm việc đến năng suất làm việc của công nhân.","A.Phân chia công việc thành nhiều phần việc đơn giản, sau đó huấn luyện cho mỗi công nhân chỉ chuyên thực hiện 1 hay 2 phần việc","B.Ảnh hưởng của ánh sáng nơi làm việc đến năng suất làm việc của công nhân.","C.Đề ra một hệ thống các chức năng quản trị","D.Đưa ra 4 nguyên lý về sự phối hợp"
"3","1","single","Hoạch định tạo thuận lợi cho việc kiểm tra như thế nào?","B","B.Cung cấp các mục tiêu rõ ràng làm tiêu chuẩn đo lường.","A.Giảm bớt chi phí cho công tác kiểm tra.","B.Cung cấp các mục tiêu rõ ràng làm tiêu chuẩn đo lường.","C.Đánh giá hiệu suất dựa trên cảm quan của nhà quản trị.","D.Tăng thời gian kiểm tra."
"3","2","single","Hoạch định mục tiêu được hiểu là gì?","C","C.Xác định kết quả cụ thế mà tổ chức cần đạt được trong một thời gian cụ thể.","A.Xây dựng các thủ tục chi tiết cho từng hoạt động.","B.Xác định cách thức thực hiện hành động của tổ chức.","C.Xác định kết quả cụ thế mà tổ chức cần đạt được trong một thời gian cụ thể.","D.Xác định ngân sách tài chính cần thiết để đạt mục tiêu"
"3","3","single","Chỉ ra sự khác biệt giữa hoạch định chính sách và hoạch định thủ tục?","A","A.Chính sách hướng dẫn việc ra quyết định trong phạm vi rộng, còn thủ tục là chuỗi hoạt động cần thực hiện theo thứ tự thời gian.","A.Chính sách hướng dẫn việc ra quyết định trong phạm vi rộng, còn thủ tục là chuỗi hoạt động cần thực hiện theo thứ tự thời gian.","B.Chính sách và thủ tục không có mối quan hệ với nhau","C.Chính sách tập trung vào hướng dẫn hành động, còn thủ tục tập trung vào việc ra quyết định.","D.Chính sách chỉ tồn tại ở cấp quản lý, còn thủ tục áp dụng cho mọi cấp bậc."
"3","4","single","Bước đầu tiên trong quá trình lập kế hoạch là gì?","D","D.Nhận thức cơ hội.","A.Xác định các phương án lựa chọn.","B.Thiết lập mục tiêu.","C.Lượng hóa các kế hoạch bằng ngân quỹ.","D.Nhận thức cơ hội."
"3","5","single","Diễn đạt vai trò của việc xác định mục tiêu khi lập kế hoạch? A.Xác định kết quả mong muốn cần đạt được và điểm kết thúc của hành","A","động","động","B.Đưa ra các giả định về môi trường bên ngoài.","C.Xác định phương pháp cụ thể để thực hiện nhiệm vụ.","D.Tìm kiếm và phát triển các phương án hành động."
"3","6","single","Nhận diện nội dung tổ chức cần thực hiện sau khi xác định các phương án trong quá trình lập kế hoạch?","B","B.Đánh giá các phương án lựa chọn","A.Phát triển các kế hoạch phụ trợ.","B.Đánh giá các phương án lựa chọn","C.Ra quyết định cuối cùng.","D.Xây dựng ngân quỹ cho các phương án."
"3","7","single","Diễn đạt mục đích của bước kiểm tra trong quá trình quản trị theo mục tiêu?","B","B.Phát hiện những khó khăn hoặc sai lệch so với mục tiêu ban đầu.","A.Xử lý kịp thời nhân viên làm sai.","B.Phát hiện những khó khăn hoặc sai lệch so với mục tiêu ban đầu.","C.Tăng cường đầu tư nguồn lực cho việc thực hiện mục tiêu.","D.Tăng thời gian thực hiện của nhân viên."
"3","8","single","Giải thích vì sao khi quản trị theo mục tiêu, việc đề ra các mục tiêu xác đáng rất khó khăn?","B","B.Cần có nhiều thời gian và phải nghiên cứu kỹ lưỡng.","A.Cần nhiều người tham gia.","B.Cần có nhiều thời gian và phải nghiên cứu kỹ lưỡng.","C.Cần đầu tư nhiều kinh phí.","D.Cần có sự đồng thuận của tất cả mọi người trong tổ chức."
"3","9","single","Doanh nghiệp A thực hiện quản trị theo mục tiêu. Khi tiến hành tổng kết và đánh giá quá trình thực hiện, doanh nghiệp A có thể xác định thành tích của nhân viên dựa trên cơ sở nào?","D","D.Mức độ hoàn thành mục tiêu đã cam kết của nhân viên","A.Sự điều chỉnh các sai lệch trong quá trình thực hiện mục tiêu của nhân viên.","B.Mức độ đánh giá chủ quan của nhà quản trị.","C.Công việc đã cam kết của nhân viên.","D.Mức độ hoàn thành mục tiêu đã cam kết của nhân viên"
"3","10","single","Hoạch định chiến lược là gì? A.Là quá trình phân tích môi trường bên trong và bên ngoài của tổ chức cho phép tổ chức đó hoạt động một cách thành công","D","D.Là quá trình xác định sứ mệnh, mục tiêu của tổ chức, phân tích môi trường bên ngoài và bên trong, đề ra những chiến lược cho phép tổ chức đó hoạt động một cách thành công","B.Là quá trình xác định sứ mệnh, mục tiêu của tổ chức cho phép tổ chức đó","hoạt động một cách thành công","C.Là quá trình đề ra các hành động của tổ chức cho phép tổ chức đó hoạt động một cách thành công","D.Là quá trình xác định sứ mệnh, mục tiêu của tổ chức, phân tích môi trường bên ngoài và bên trong, đề ra những chiến lược cho phép tổ chức đó hoạt động một cách thành công"
"3","11","single","Giải thích vì sao hoạch định chiến lược lại giúp tổ chức nâng cao tinh thần đội ngũ nhân viên?","C","C.Truyền đạt rõ ràng các lý tưởng như tầm nhìn, sứ mệnh và giá trị cốt lõi","A.Loại bỏ nhu cầu tổ chức các cuộc họp trong doanh nghiệp","B.Giúp giảm khối lượng công việc cho nhân viên","C.Truyền đạt rõ ràng các lý tưởng như tầm nhìn, sứ mệnh và giá trị cốt lõi","D.Khuyến khích sự cạnh tranh nội bộ giữa các nhóm"
"3","12","single","Nhận diện nội dung ""Chiến lược trả lời cho câu hỏi: Doanh nghiệp sẽ nằm ở đâu trong những ngành kinh doanh nào, vị trí của doanh nghiệp đối với môi trường và vai trò của từng ngành kinh doanh trong doanh nghiệp"" thể hiện cho cấp chiến lược nào sau đây?","D","D.Chiến lược cấp doanh nghiệp","A.Chiến lược cấp kinh doanh","B.Chiến lược cấp đơn vị","C.Chiến lược cấp chức năng","D.Chiến lược cấp doanh nghiệp"
"3","13","single","Chỉ ra thành phần quan trọng nhất quyết định mục tiêu của doanh nghiệp?","B","B.Chủ doanh nghiệp.","A.Khách hàng.","B.Chủ doanh nghiệp.","C.Người lao động.","D.Tổ chức xã hội."
"3","14","single","Nhận diện trường hợp nguy cơ đối thủ cạnh tranh mới của doanh nghiệp sẽ xuất hiện?","D","D.Chi phí gia nhập ngành thấp và có ít rào cản chuyển dịch","A.Nguồn cung cấp nguyên liệu bị kiểm soát chặt chẽ","B.Công nghệ hiện tại không dễ sao chép","C.Thị trường không hấp dẫn với các nhà đầu tư mới","D.Chi phí gia nhập ngành thấp và có ít rào cản chuyển dịch"
"3","15","single","Doanh nghiệp A sử dụng phương pháp SWOT để xây dựng chiến lược phát triển cho doanh nghiệp. Doanh nghiệp có thể sử dụng câu hỏi nào để xác định điểm mạnh của doanh nghiệp?","D","D.Điều gì làm khách hàng hài lòng về doanh nghiệp?","A.Sự phát triển của công nghệ có ảnh hưởng tiêu cực gì tới doanh nghiệp?","B.Quy trình nào mà doanh nghiệp cần phải cải thiện?","C.Những tài sản nào mà doanh nghiệp cần phải bổ sung?","D.Điều gì làm khách hàng hài lòng về doanh nghiệp?"
"3","16","single","Mục đích chính của hoạch định chính sách là gì?","C","C.Hướng dẫn việc ra quyết định và đảm bảo các quyết định hướng tới mục tiêu.","A.Kiểm soát toàn bộ hoạt động của tổ chức.","B.Đưa ra chương trình ngân sách phù hợp với chiến lược.","C.Hướng dẫn việc ra quyết định và đảm bảo các quyết định hướng tới mục tiêu.","D.Thiết lập một chuỗi hành động cần thực hiện."
"3","17","single","Giải thích vì sao phải xác định nhiều phương án trong quá trình lập kế hoạch?","D","D.Để giảm thiểu rủi ro và chọn ra các phương án triển vọng nhất.","A.Để đảm bảo tất cả các phương án được thực hiện cùng lúc.","B.Để tập trung vào một phương án duy nhất.","C.Để tiết kiệm thời gian đánh giá phương án.","D.Để giảm thiểu rủi ro và chọn ra các phương án triển vọng nhất."
"3","18","single","Nhận diện nội dung tổ chức cần thực hiện sau khi xây dựng các kế hoạch phụ trợ trong quá trình lập kế hoạch","A","A.Lượng hóa các kế hoạch bằng ngân quỹ.","A.Lượng hóa các kế hoạch bằng ngân quỹ.","B.Xác định các phương án lựa chọn.","C.Ra quyết định cuối cùng.","D.Đánh giá các phương án lựa chọn."
"3","19","single","Chỉ ra những vấn đề sẽ được bộc lộ trong quá trình cấp dưới vạch ra các mục tiêu?","A","A.Các vấn đề cần giải quyết.","A.Các vấn đề cần giải quyết.","B.Các yếu tố tác động đến tổ chức từ môi trường bên ngoài.","C.Trách nhiệm của cấp trên đối với tổ chức.","D.Mục tiêu chung của cả tổ chức."
"3","20","single","Hoạch định chiến lược giúp doanh nghiệp làm gì?","A","A.Xác định rõ mục tiêu và định hướng phát triển cụ thể","A.Xác định rõ mục tiêu và định hướng phát triển cụ thể","B.Tập trung vào việc cắt giảm chi phí nhân sự","C.Phát triển các sản phẩm mới mà không cần nghiên cứu thị trường","D.Tăng cường sự cạnh tranh nội bộ trong doanh nghiệp"
"3","21","single","Giải thích vì sao hoạch định chiến lược lại giúp tổ chức vận hành tối ưu nguồn lực?","A","A.Giúp xác định hoạt động cần thiết và thiết lập ngân sách đầu tư đúng đắn","A.Giúp xác định hoạt động cần thiết và thiết lập ngân sách đầu tư đúng đắn","B.Tăng cường nhân sự để thực hiện nhiều hoạt động cùng lúc","C.Mở rộng phạm vi đầu tư để tăng cơ hội phát triển","D.Đơn giản hóa quy trình làm việc bằng cách loại bỏ hoàn toàn các bước kiểm soát"
"3","22","single","Chỉ ra điểm khác nhau giữa mục tiêu với sứ mệnh khi hoạch định chiến lược?","B","B.Mục tiêu cụ thể hơn sứ mệnh","A.Mục tiêu chỉ phản ánh lợi nhuận của doanh nghiệp","B.Mục tiêu cụ thể hơn sứ mệnh","C.Mục tiêu chỉ áp dụng cho cấp quản lý cao nhất","D.Mục tiêu không liên quan đến sứ mệnh"
"3","23","single","Diễn giải công việc nhà quản trị cần thực hiện trong bước 1 của quản trị theo mục tiêu? A.Cùng với cấp dưới bàn bạc, thảo luận về những mục tiêu mà cấp dưới có thể thực hiện được.","D","D.Xác định vai trò cho các đơn vị tham gia vào việc thực hiện mục tiêu.","B.Tiến hành kiểm tra nhằm phát hiện những khó khăn hoặc sai lệch.","C.Cung cấp các điều kiện, phương tiện và các nguồn lực cần thiết cho cấp","dưới thực hiện mục tiêu.","D.Xác định vai trò cho các đơn vị tham gia vào việc thực hiện mục tiêu."
"3","24","single","Chỉ ra nhận định ĐÚNG trong các nhận định sau đây về quản trị theo mục tiêu?","A","A.Việc đặt mục tiêu cho thời gian ngắn có thể gây tổn thất cho mục tiêu dài hạn","A.Việc đặt mục tiêu cho thời gian ngắn có thể gây tổn thất cho mục tiêu dài hạn","B.Việc đề ra các mục tiêu xác đáng rất dễ dàng và không cần nhiều thời gian.","C.Các nhà quản lý luôn sẵn sàng thay đổi mục tiêu mà không gặp khó khăn.","D.Việc đặt mục tiêu cho thời gian ngắn không liên quan gì đến việc thiết lập mục tiêu dài hạn."
"3","25","single","Nhận diện đặc điểm môi trường vĩ mô của tổ chức?","C","C.Tác động gián tiếp, phạm vi rất lớn và khó kiểm soát","A.Tác động chủ yếu đến một ngành cụ thể","B.Tác động trực tiếp và thay đổi nhanh chóng","C.Tác động gián tiếp, phạm vi rất lớn và khó kiểm soát","D.Phạm vi hẹp, dễ nhận biết và kiểm soát được"
"3","26","single","Chỉ ra yếu tố cấu thành môi trường vĩ mô của tổ chức?","B","B.Yếu tố xã hôi","A.Nhà cung cấp","B.Yếu tố xã hôi","C.Các khách hàng","D.Đối thủ cạnh tranh"
"3","27","single","Chỉ ra yếu tố cấu thành môi trường vì mô của tổ chức?","A","A.Yếu tố tự nhiên","A.Yếu tố tự nhiên","B.Nguy cơ từ đối thủ mới","C.Các khách hàng","D.Đối thủ cạnh tranh"
"3","28","single","Chỉ ra yếu tố cấu thành môi trường vi mô của tổ chức?","C","C.Các khách hàng","A.Yếu tố tự nhiên","B.Yếu tố xã hội","C.Các khách hàng","D.Yếu tố kỹ thuật"
"3","29","single",". Nội dung “Đưa ra những điều khoản hay những quy định chung để hướng dẫn hoặc triển khai suy nghĩ và hành động của con người khi ra quyết định” thể hiện loại hoạch định nào sau đây?","B","B.Hoạch định chính sách","A.Hoạch định chiến lược","B.Hoạch định chính sách","C.Hoạch định thủ tục","D.Hoạch định quy tắc"
"3","30","single","Mục đích chính của hoạch định chính sách là gì?","C","C.Hướng dẫn việc ra quyết định và đảm bảo các quyết định hướng tới mục tiêu.","A.Kiểm soát toàn bộ hoạt động của tổ chức.","B.Đưa ra chương trình ngân sách phù hợp với chiến lược.","C.Hướng dẫn việc ra quyết định và đảm bảo các quyết định hướng tới mục tiêu.","D.Thiết lập một chuỗi hành động cần thực hiện."
"4","1","single","Một tổ chức có tầm quản trị hẹp thường có đặc điểm nào sau đây?","B","B.Số lượng cấp quản trị nhiều, nhưng số lượng nhân viên cấp dưới của mỗi cấp quản trị ít","A.Số lượng cấp quản trị ít","B.Số lượng cấp quản trị nhiều, nhưng số lượng nhân viên cấp dưới của mỗi cấp quản trị ít","C.Ít chi phí quản lý hơn tổ chức có tầm quản trị rộng","D.Tăng tính tự chủ của cấp dưới"
"4","2","single","Một ưu điểm của cơ cấu tổ chức theo sản phẩm là gì?","D","D.Gắn trách nhiệm lãnh đạo với lợi nhuận","A.Giảm nhu cầu người quản lý giỏi","B.Tăng cường chuyên môn hóa theo chức năng","C.Tăng khả năng kiểm soát của cấp trên","D.Gắn trách nhiệm lãnh đạo với lợi nhuận"
"4","3","single","Công ty may ALT là một công ty có quy mô tổ chức lớn với nhiều dây duyền sản xuất. Anh/ chị hãy lựa chọn cách phân chia bộ phận phù hợp để thiết kế cơ cấu tổ chức cho Công ty may ALT?","D","D.Phân chia bộ phân theo sản phẩm","A.Phân chia bộ phận theo địa dư","B.Phân chia bộ phận theo chức năng","C.Phân chia bộ phận theo khách hàng","D.Phân chia bộ phân theo sản phẩm"
"4","4","single","Quyền hạn theo chức năng là gì?","D","D.Quyền kiểm soát các hoạt động của nhân viên ở bộ phận khác","A.Quyền ra chỉ thị mà không cần sự đồng ý","B.Quyền quản lý trực tiếp mọi hoạt động của bộ phận","C.Quyền quyết định về mọi vấn đề trong tổ chức","D.Quyền kiểm soát các hoạt động của nhân viên ở bộ phận khác"
"4","5","single","Nhận diện đâu là hạn chế của việc sử dụng tham mưu trong hoạt động quản lý?","A","A.Dễ phát sinh mâu thuẫn giữa bộ phận trực tuyến và bộ phận tham mưu","A.Dễ phát sinh mâu thuẫn giữa bộ phận trực tuyến và bộ phận tham mưu","B.Giảm bớt trách nhiệm của bộ phận tham mưu","C.Tạo ra môi trường làm việc thoải mái","D.Tăng sự tập trung cho công việc chuyên môn"
"4","6","single","Nhận diện đâu là hạn chế của việc sử dụng quyền hạn chức năng trong tổ chức?","D","D.Tạo ra sự phân tán và chồng chéo về quyền hạn","A.Giảm sự phức tạp trong công việc quản lý","B.Không tạo ra sự phức tạp trong các quan hệ quản lý","C.Tăng cường sự nhất quán trong các mệnh lệnh","D.Tạo ra sự phân tán và chồng chéo về quyền hạn"
"4","7","single","Phân quyền có thể giúp tổ chức đạt được điều gì?","D","D.Tăng cường sự sáng tạo và phát huy khả năng tự chủ của cấp dưới","A.Tạo ra sự tập trung quyền lực mạnh mẽ","B.Giảm thiểu rủi ro trong công việc","C.Giảm bớt công việc cho cấp trên","D.Tăng cường sự sáng tạo và phát huy khả năng tự chủ của cấp dưới"
"4","8","single","Xác định yếu tố nào sau đây KHÔNG ảnh hưởng đến mức độ phân quyền?","A","A.Mối quan hệ giữa các cấp trong tổ chức","A.Mối quan hệ giữa các cấp trong tổ chức","B.Phong cách quản lý của lãnh đạo","C.Giá trị quyết định","D.Quy mô tổ chức"
"4","9","single","Trong một tổ chức, người lãnh đạo yêu cầu các trưởng phòng chỉ quyết định các vấn đề thuộc phạm vi bộ phận mình, đồng thời cũng nhấn mạnh rằng họ phải chịu trách nhiệm về kết quả công việc của bộ phận mình. Tuy nhiên, người lãnh đạo không cho phép các trưởng phòng quyết định về các vấn đề tài chính lớn hay chiến lược của công ty. Hành động của người lãnh đạo phản ánh nguyên tắc nào trong việc giao quyền?","B","B.Nguyên tắc giao quyền theo chức năng","A.Nguyên tắc quyền hạn theo cấp bậc","B.Nguyên tắc giao quyền theo chức năng","C.Nguyên tắc về tính tuyệt đối trong trách nhiệm","D.Nguyên tắc giao quyền theo kết quả mong muốn"
"4","10","single","Mục tiêu của việc lập kế hoạch trong công tác tổ chức là gì?","D","D.Xác định nhu cầu nhân sự trong tương lai","A.Đảm bảo quyền lực của các bộ phận tham mưu","B.Phân chia công việc cho cấp dưới trực tiếp","C.Lựa chọn các công việc không quan trọng","D.Xác định nhu cầu nhân sự trong tương lai"
"4","11","single","Nhận diện một trong những sai lầm phổ biến trong công tác quản lý?","A","A.Giao quyền mà không giao trách nhiệm","A.Giao quyền mà không giao trách nhiệm","B.Phân công công việc chính thức","C.Tạo ra các sơ đồ tổ chức rõ ràng","D.Đưa ra quyết định nhanh chóng"
"4","12","single","Xác định những nguy cơ có thể xảy ra nếu việc giao quyền mà không giao trách nhiệm trong hoạt động quản lý?","C","C.Làm giảm hiệu quả công việc","A.Tạo ra sự rõ ràng trong công việc","B.Giúp công việc được hoàn thành nhanh chóng","C.Làm giảm hiệu quả công việc","D.Tăng cường sự sáng tạo trong tổ chức"
"4","13","single","Xác định những nguy cơ có thể xảy ra nếu nếu sử dụng tham mưu một cách cẩu thả?","C","C.Làm mất dần quyền hành của người lãnh đạo","A.Tăng cường quyền lực của người lãnh đạo","B.Giảm chi phí hoạt động","C.Làm mất dần quyền hành của người lãnh đạo","D.Cải thiện hiệu quả công việc"
"4","14","single","Xác định nguy cơ có thể xảy ra nếu sử dụng tham mưu quá nhiều trong hoạt động quản lý?","A","A.Làm giảm hiệu quả lãnh đạo","A.Làm giảm hiệu quả lãnh đạo","B.Đảm bảo quyết định được đưa ra nhanh chóng","C.Tăng cường sự phân công công việc","D.Tạo ra sự linh hoạt trong cơ cấu tổ chức"
"4","15","single","Giả sử bạn là người quản lý trong một doanh nghiệp, sau khi nhận thấy cơ cấu tổ chức hiện tại không đáp ứng được yêu cầu của thị trường, bạn sẽ làm gì để nâng cao hiệu quả công tác tổ chức? A.Cải thiện hệ thống đào tạo nhân viên mà không thay đổi cơ cấu tổ chức","C","trường và nhu cầu nhân sự","B.Tăng cường quyền lực cho các bộ phận tham mưu mà không thay đổi sơ đồ tổ chức","C.Lập kế hoạch tổ chức lại cơ cấu để phù hợp với sự thay đổi của môi","trường và nhu cầu nhân sự","D.Giảm số lượng cấp quản lý mà không thay đổi công việc của các bộ phận"
"4","16","single","Nhược điểm lớn nhất của tầm quản trị rộng là gì?","B","B.Dễ dẫn đến tình trạng cấp trên quá tải và mất kiểm soát","A.Làm cồng kềnh bộ máy quản lý","B.Dễ dẫn đến tình trạng cấp trên quá tải và mất kiểm soát","C.Giảm quyền tự chủ của cấp dưới","D.Tăng chi phí quản lý"
"4","17","single","Ưu điểm chính của việc phân chia tổ chức theo cơ cấu chức năng là gì?","A","A.Góp phần đạt được sự chuyên môn hóa sâu công việc","A.Góp phần đạt được sự chuyên môn hóa sâu công việc","B.Tạo điều kiện cho sự phối hợp giữa các bộ phận chức năng","C.Đơn giản hóa công tác quản lý","D.Tăng tính tự chủ của các bộ phận"
"4","18","single","Định nghĩa quyền hạn trong tổ chức được hiểu là gì?","D","D.Mức độ độc lập trong hoạt động dành cho các nhà quản trị","A.Phẩm chất cá nhân của nhà quản trị","B.Quyền lực của nhà quản trị để kiểm soát nhân viên","C.Quyền ra chỉ thị mà không cần quyết định","D.Mức độ độc lập trong hoạt động dành cho các nhà quản trị"
"4","19","single","Nhận diện nguyên tắc nào thể hiện việc đảm bảo tính thống nhất trong mệnh lệnh khi giao quyền?","A","A.Nguyên tắc thống nhất trong mệnh lệnh","A.Nguyên tắc thống nhất trong mệnh lệnh","B.Nguyên tắc giao quyền theo kết quả mong muốn","C.Nguyên tắc về sự tương xứng giữa quyền hạn và trách nhiệm","D.Nguyên tắc quyền hạn theo cấp bậc"
"4","20","single","Xác định những nguy cơ có thể xảy nếu có quá nhiều cấp quản lý trong tổ chức?","B","B.Giảm hiệu quả quản lý và làm việc","A.Tăng cường sự sáng tạo","B.Giảm hiệu quả quản lý và làm việc","C.Cải thiện mối quan hệ giữa các cấp","D.Tạo ra một cơ cấu tổ chức linh hoạt"
"4","21","single","Xác định đâu là vấn đề cần tránh để thiết kế tổ chức một cách hiệu quả?","D","D.Cứng nhắc trong việc thực hiện các chính sách mới","A.Phân biệt rõ vai trò và nhiệm vụ của từng bộ phận","B.Linh hoạt trong việc điều chỉnh cơ cấu tổ chức","C.Đảm bảo mỗi nhân viên hiểu rõ công việc của mình","D.Cứng nhắc trong việc thực hiện các chính sách mới"
"4","22","single","Một cơ cấu tổ chức hợp lý sẽ ảnh hưởng thế nào đến tổ chức?","C","C.Góp phần phát huy sức mạnh của tập thể và đội ngũ quản lý","A.Tạo ra nhiều cơ cấu không chính thức","B.Giảm chi phí hoạt động","C.Góp phần phát huy sức mạnh của tập thể và đội ngũ quản lý","D.Tăng số lượng nhân viên cấp dưới"
"4","23","single","Khi nào quyền lực được giao phó có thể bị thu hồi?","C","C.Khi có sự thay đổi trong tổ chức","A.Khi cấp dưới không hoàn thành nhiệm vụ","B.Khi cấp dưới yêu cầu thu hồi quyền hạn","C.Khi có sự thay đổi trong tổ chức","D.Khi cấp trên không muốn chịu trách nhiệm"
