lesson_no,question_no,type,question,correct_letters,correct_answers,option_a,option_b,option_c,option_d
"4","24","single","Đâu là lý do chính để thiết kế lại cơ cấu tổ chức?","A","A.Để ứng phó với thay đổi của môi trường và chính sách","A.Để ứng phó với thay đổi của môi trường và chính sách","B.Để giảm sự tham gia của cấp dưới","C.Để tăng cường quyền lực của cấp trên","D.Để giảm chi phí hoạt động"
"4","25","single","Nhận diện ý nghĩa của việc xác định mục tiêu và lập kế hoạch trong công tác tổ chức?","D","D.Giúp xác định rõ nhu cầu nhân sự và các chương trình đào tạo","A.Đảm bảo sự ổn định tuyệt đối","B.Tăng cường sự tham gia của các bộ phận phục vụ","C.Giảm thiểu chi phí tổ chức","D.Giúp xác định rõ nhu cầu nhân sự và các chương trình đào tạo"
"4","26","single","Nhận diện đâu là lợi ích của việc sử dụng tham mưu trong hoạt động quản lý?","C","C.Giảm bớt công việc cho người lãnh đạo trực tuyến","A.Khó khăn trong việc ra quyết định","B.Làm giảm chất lượng quyết định của người quản lý","C.Giảm bớt công việc cho người lãnh đạo trực tuyến","D.Tăng cường quyền lực của các bộ phận tham mưu"
"4","27","single","Tầm quản trị rộng thường xuất hiện khi nào?","C","C.Nhà quản trị có đầy đủ năng lực và cấp dưới làm việc hiệu quả","A.Công việc phức tạp và nhiều thay đổi","B.Nhà quản trị chưa phân quyền hiệu quả","C.Nhà quản trị có đầy đủ năng lực và cấp dưới làm việc hiệu quả","D.Mối quan hệ trong tổ chức không rõ ràng"
"4","28","single","Nhược điểm của cơ cấu tổ chức phân chia bộ phận theo chức năng là gì?","D","D.Tạo ra cách nhìn quá hẹp với các lãnh đạo chức năng","A.Tăng sự phối hợp giữa các bộ phận","B.Khó kiểm soát các hoạt động chức năng","C.Làm giảm trách nhiệm của lãnh đạo cấp cao","D.Tạo ra cách nhìn quá hẹp với các lãnh đạo chức năng"
"4","29","single","Điểm khác biệt chính giữa quyền hạn trực tuyến và quyền hạn theo chức năng là gì?","B","B.Quyền hạn theo chức năng liên quan đến kiểm soát hoạt động của các bộ phận khác","A.Quyền hạn trực tuyến tập trung vào quyết định cấp cao nhất","B.Quyền hạn theo chức năng liên quan đến kiểm soát hoạt động của các bộ phận khác","C.Quyền hạn trực tuyến chỉ áp dụng trong tổ chức nhỏ","D.Quyền hạn theo chức năng tập trung vào phân công nhiệm vụ"
"4","30","single","Nhân tố nào không ảnh hưởng trực tiếp đến tầm quản trị hiệu quả?","D","D.Phong cách làm việc của nhân viên","A.Năng lực của người quản lý","B.Đặc điểm và độ phức tạp của công việc","C.Quy mô tổ chức","D.Phong cách làm việc của nhân viên"
"5","1","single","Mục tiêu của quản trị nhân sự là gì?","B","B.Kết hợp hài hòa mục tiêu của cá nhân và tổ chức","A.Đảm bảo người lao động làm việc lâu dài","B.Kết hợp hài hòa mục tiêu của cá nhân và tổ chức","C.Chỉ tập trung phát triển tổ chức","D.Đạt được mục tiêu của tổ chức mà không quan tâm đến mục tiêu cả nhân"
"5","2","single","Quyền lợi mà người lao động nhận được nên được hiểu như thế nào?","C","C.Là kết quả lao động của chính họ","A.Là sự hỗ trợ từ tổ chức","B.Là sự ban ơn của doanh nghiệp","C.Là kết quả lao động của chính họ","D.Là phần thưởng từ cấp trên"
"5","3","single","Nhận diện hoạt động nào dưới đây không thuộc nội dung của quản trị nhân sự?","A","A.Quản lý tài sản","A.Quản lý tài sản","B.Đề bạt","C.Tuyển dụng","D.Đánh giá"
"5","4","single","Khi xác định nhu cầu nhân lực, yếu tố nào sau đây khó dự đoán nhất?","D","D.Quy mô và cơ cấu lao động dài hạn","A.Biến động nhân lực ngắn hạn","B.Tình hình tài chính của doanh nghiệp","C.Mức lương thị trường","D.Quy mô và cơ cấu lao động dài hạn"
"5","5","single","Nhận diện đâu là lợi ích của phương pháp phỏng vấn thiết kế sẵn là gì?","A","A.Cung cấp thông tin rõ ràng và nhất quán","A.Cung cấp thông tin rõ ràng và nhất quán","B.Tăng khả năng gây ấn tượng của ứng viên","C.Giúp người phỏng vấn tiết kiệm thời gian chuẩn bị","D.Giảm thiểu sự thiên vị của người phỏng vấn"
"5","6","single","Công ty A đang cần tuyển dụng 01 nhân viên có kinh nghiệm 02 năm làm việc, bạn là nhân viên tuyển dụng của công ty, bạn sẽ thực hiện tuyển dụng ở đâu?","A","A.Tuyển dụng trên các trang tuyển dụng","A.Tuyển dụng trên các trang tuyển dụng","B.Tại hội chợ việc làm","C.Thông báo tuyển dụng trên tivi","D.Tại các trường đại học"
"5","7","single","Đánh giá dựa trên mức độ hoàn thành mục tiêu có ưu điểm gì?","A","A.Đảm bảo tính khách quan và liên kết chặt chẽ với nhiệm vụ thực tế","A.Đảm bảo tính khách quan và liên kết chặt chẽ với nhiệm vụ thực tế","B.Tăng cường tính chủ quan trong đánh giá","C.Giảm thiểu sự can thiệp của cấp trên","D.Tạo ra một môi trường làm việc thoải mái cho cấp dưới"
"5","8","single","Việc tách biệt mức độ quan trọng của các yếu tố trong quá trình đánh giá nhằm mục đích gì?","B","B.Để đưa ra kết luận chính xác và công bằng","A.Để tránh sự phê phán không công bằng","B.Để đưa ra kết luận chính xác và công bằng","C.Để tăng tính chủ quan trong đánh giá","D.Để giảm bớt công việc của cấp trên"
"5","9","single","Xác định yếu tố nào dưới đây không nên bổ sung khi đánh giá cán bộ quản lý?","B","B.Vóc dáng, thể trạng","A.Chất lượng công việc","B.Vóc dáng, thể trạng","C.Mối quan hệ với khách hàng","D.Kỹ năng cá nhân và phẩm chất công tác"
"5","10","single","Xác định đâu là hạn chế lớn nhất của việc đánh giá dựa trên mức độ hoàn thành mục tiêu?","D","D.Tập trung quá nhiều vào kết quả công việc, bỏ qua sự phát triển cá nhân","A.Không thể đo lường kết quả công việc của người quản lý","B.Tính chất chủ quan trong việc đánh giá quá cao","C.Người quản lý dễ dàng đạt được mục tiêu mà không có sự sáng tạo","D.Tập trung quá nhiều vào kết quả công việc, bỏ qua sự phát triển cá nhân"
"5","11","single","Xác định nhược điểm của phương pháp đánh giá theo tư cách?","B","B.Mang tính chủ quan và không đánh giá được trình độ chuyên môn","A.Phản ảnh đầy đủ sự phát triển của người quản lý","B.Mang tính chủ quan và không đánh giá được trình độ chuyên môn","C.Tính chất đánh giá rất khách quan","D.Quá tập trung vào kết quả tài chính của tổ chức"
"5","12","single","Một quản lý trong công ty thường đạt được các mục tiêu doanh thu của bộ phận nhưng có nhiều phản ánh từ nhân viên rằng người này thường xuyên áp đặt ý kiến và không lắng nghe đóng góp. Là người đánh giá, bạn sẽ đánh giá như thế nào?","D","D.Đánh giá toàn diện, ghi nhận kết quả đạt được nhưng cũng nêu rõ các phản hồi tiêu cực từ nhân viên để đưa ra kế hoạch cải thiện kỹ năng lãnh đạo","A.Gạt bỏ phản hồi từ nhân viên vì kết quả công việc của bộ phận đã đạt mục tiêu","B.Chỉ tập trung vào kết quả đạt được và đánh giá cao năng lực lãnh đạo của quản lý này","C.Nhấn mạnh vào phản hồi của nhân viên và yêu cầu quản lý thay đổi phong cách làm việc","D.Đánh giá toàn diện, ghi nhận kết quả đạt được nhưng cũng nêu rõ các phản hồi tiêu cực từ nhân viên để đưa ra kế hoạch cải thiện kỹ năng lãnh đạo"
"5","13","single","Mục tiêu của công tác phát triển cán bộ trong doanh nghiệp là gì?","D","D.Kết hợp mục tiêu của doanh nghiệp với nhu cầu phát triển cán bộ","A.Tổ chức nhiều khóa đào tạo với số lượng lớn","B.Tập trung vào kết quả đào tạo chứ không phải số lượng khóa học","C.Tăng cường đào tạo cho một nhóm nhân viên riêng biệt","D.Kết hợp mục tiêu của doanh nghiệp với nhu cầu phát triển cán bộ"
"5","14","single","Theo mô hình phát triển cán bộ, nhận diện yếu tố nào dưới đây là quan trọng nhất?","B","B.Sự kết hợp hài hòa giữa mục tiêu doanh nghiệp và mục tiêu phát triển cán bộ","A.Đào tạo theo từng nhóm nhân viên","B.Sự kết hợp hài hòa giữa mục tiêu doanh nghiệp và mục tiêu phát triển cán bộ","C.Đào tạo chỉ dành cho nhân viên cấp cao","D.Sự tham gia của các nhà quản trị cấp thấp"
"5","15","single","Nhận diện đâu là ý nghĩa của sự hỗ trợ của nhà quản trị cấp cao đối với chương trình phát triển cán bộ?","C","C.Rất quan trọng, giúp đảm bảo chương trình thành công và đạt hiệu quả cao","A.Chỉ quan trọng khi đào tạo cho nhân viên cấp cao","B.Không quan trọng vì chương trình chỉ dành cho nhân viên cấp thấp","C.Rất quan trọng, giúp đảm bảo chương trình thành công và đạt hiệu quả cao","D.Quan trọng nhưng không phải là yếu tố quyết định"
"5","16","single","Xác định các yếu tố thuộc tiêu chuẩn cảm xúc và tình cảm của người lao động?","C","C.Sự điềm đạm hoặc nóng tính","A.Kỹ năng chuyên môn","B.Kinh nghiệm thực tế","C.Sự điềm đạm hoặc nóng tính","D.Tư duy nhanh nhẹn"
"5","17","single","Nhu cầu nhân lực của doanh nghiệp được xác định dựa trên yếu tố nào sau đây?","D","D.Chiến lược phát triển và biến động nhân lực trong doanh nghiệp","A.Kế hoạch phát triển của đối thủ cạnh tranh","B.Mức độ cạnh tranh của thị trường lao động","C.Tình hình kinh tế xã hội chung","D.Chiến lược phát triển và biến động nhân lực trong doanh nghiệp"
"5","18","single","Xác định thời điểm một chương trình phát triển cán bộ được coi là hiệu quả?","C","C.Khi đạt được những kết quả cụ thể và lợi ích rõ ràng","A.Khi chỉ phục vụ cho một nhóm nhỏ nhân viên có năng lực","B.Khi tập trung vào số lượng nhân viên tham gia","C.Khi đạt được những kết quả cụ thể và lợi ích rõ ràng","D.Khi nhà quản trị cấp cao không tham gia"
"5","19","single","Điểm mạnh của phương pháp đánh giá theo tư cách là gì?","B","B.Giúp người quản lý chú ý đến các vấn đề quan trọng trong công việc","A.Giảm thiểu việc đánh giá sai lệch","B.Giúp người quản lý chú ý đến các vấn đề quan trọng trong công việc","C.Tạo điều kiện để phát triển các kỹ năng mềm của người quản lý","D.Giúp đánh giá một cách khách quan và chính xác các kết quả công việc"
"5","20","single","Quản trị nhân sự là gì?","D","D.Quá trình thu nhận, sử dụng, đào tạo và phát triển nguồn nhân lực","A.Quá trình đào tạo người lao động","B.Quá trình tuyển dụng nhân sự","C.Quá trình đánh giá hiệu suất làm việc","D.Quá trình thu nhận, sử dụng, đào tạo và phát triển nguồn nhân lực"
"5","21","single","Nhận diện phương pháp nào dưới đây là cách thức giúp người học phát triển qua việc làm việc trực tiếp, thường xuyên với nhà quản trị có kinh nghiệm?","D","D.Lập ra các cương vị trợ lý","A.Đào tạo qua các hội nghị","B.Sự đề bạt tạm thời","C.Đào tạo lý thuyết tại lớp học","D.Lập ra các cương vị trợ lý"
"5","22","single","Đánh giá dựa trên mục tiêu giúp giảm thiếu yếu tố nào trong quá trình đánh giá?","D","D.Yếu tố chủ quan","A.Yếu tố tài chính","B.Yếu tố may măn","C.Yếu tố nhân sự","D.Yếu tố chủ quan"
"5","23","single","Tại sao một số tổ chức yêu cầu cấp dưới tự xếp hạng mình? A.Để cấp dưới tự nhận thức về hiệu quả công việc và so sánh với đánh giá","A","của cấp trên","của cấp trên","B.Để đánh giá khả năng quản lý của cấp trên","C.Để giảm tải công việc cho cấp trên","D.Để tăng cường mối quan hệ giữa cấp trên và cấp dưới"
"5","24","single","Trong hoạt động tuyển dụng, trắc nghiệm trí tuệ thường được dùng để đánh giá khía cạnh nào của ứng viên?","D","D.Tốc độ tư duy và trí nhớ","A.Kỹ năng nghề nghiệp","B.Phong cách làm việc","C.Sở thích cá nhân","D.Tốc độ tư duy và trí nhớ"
"5","25","single","Yếu tố nào KHÔNG thuộc nội dung của hoạt động phân tích công việc?","B","B.Sở thích cá nhân của người lao động","A.Các loại công việc cần thực hiện","B.Sở thích cá nhân của người lao động","C.Công cụ và trang thiết bị cần thiết","D.Mức lương và thời lượng làm việc"
"5","26","single","Người lao động mong muốn điều gì trong công việc?","A","A.Môi trường làm việc tốt và có cơ hội phát triển tài năng","A.Môi trường làm việc tốt và có cơ hội phát triển tài năng","B.Không cần người lãnh đạo giỏi","C.Làm việc trong môi trường cạnh tranh căng thẳng","D.Thu nhập thấp để ổn định"
"5","27","single","Tiêu chuẩn nào sau đây thuộc về yếu tố thế chất của người lao động?","B","B.Dáng mạo, cách ăn nói","A.Điềm đạm, nóng tỉnh","B.Dáng mạo, cách ăn nói","C.Nghiệp vụ, chuyên môn","D.Sự thông minh, sáng tạo"
"5","28","single","Vì sao đánh giá cán bộ quản lý theo đặc điểm cá nhân và phẩm chất công tác thường mang tính hình thức?","C","C.Vì người đánh giá cố gắng xếp hạng sao cho ít ảnh hưởng đến quyền lợi cấp dưới","A.Vì việc đánh giá được thực hiện công bằng và chính xác","B.Vì cấp dưới không được tham gia vào quá trình đánh giá","C.Vì người đánh giá cố gắng xếp hạng sao cho ít ảnh hưởng đến quyền lợi cấp dưới","D.Vì người đánh giá quá tập trung vào kết quả công việc"
"5","29","single","Đố i với công việc và điều kiện làm việc, công nhân viên đòi hỏi nơi nhà quản trị, ngoại trừ ?","B","B.Được thừa nhận trong công việc","A.Một việc làm an toàn","B.Được thừa nhận trong công việc","C.Được cảm thấy mình quan trọng và cần thiết","D.Có điều kiện phát triển tài năng"
"5","30","single","Đặc điểm nguồn nhân lực ở Việt Nam hiện nay là:","C","C.Quy mô lớn, chất lượng chưa cao, đang từ ng bước cải thiện","A.Quy mô lớn, trình độ cao","B.Quy mô nhỏ, trình độ cao","C.Quy mô lớn, chất lượng chưa cao, đang từ ng bước cải thiện","D.Quy mô lớn, chất lượng cao nhưng đang giảm sút"
"6","1","single","Liệt kê các kỹ năng cần thiết của một người lãnh đạo hiệu quả?","A","A.Kỹ năng chẩn đoán, thích ứng, giao tiếp.","A.Kỹ năng chẩn đoán, thích ứng, giao tiếp.","B.Kỹ năng phân tích, phân loại, ủy thác công việc.","C.Kỹ năng lập kế hoạch, tổ chức, kiểm soát.","D.Kỹ năng giao tiếp, kiểm tra, đánh giá."
"6","2","single","Xác định yếu tố quan trọng của kỹ năng thích ứng ở nhà lãnh đạo?","C","C.Điều chỉnh hành vi và nguồn lực linh hoạt.","A.Kiểm tra và điều chỉnh các hoạt động tổ chức.","B.Đánh giá yếu tố nội bộ và bên ngoài tổ chức.","C.Điều chỉnh hành vi và nguồn lực linh hoạt.","D.Truyền đạt thông tin rõ ràng và hiệu quả."
"6","3","single","Xác định vai trò của kỹ năng giao tiếp trong hoạt động lãnh đạo?","B","B.Tạo động lực, truyền cảm hứng, giải quyết xung đột và xây dựng mối quan hệ tích cực.","A.Điều chỉnh linh hoạt hành vi để thích ứng với các hoàn cảnh mới.","B.Tạo động lực, truyền cảm hứng, giải quyết xung đột và xây dựng mối quan hệ tích cực.","C.Giúp nhận diện các yếu tố bên trong và bên ngoài tổ chức.","D.Phân tích và hiểu rõ tình huống hiện tại của tổ chức."
"6","4","single","Diễn giải sự khác biệt giữa kỹ năng thích ứng và kỹ năng giao tiếp? A.Kỹ năng thích ứng chỉ cần trong khủng hoảng, còn kỹ năng giao tiếp cần thiết hàng ngày.","C","tiếp tập trung vào việc xây dựng lòng tin.","B.Kỹ năng thích ứng giúp điều chỉnh hành vi, còn kỹ năng giao tiếp giúp giải quyết xung đột.","C.Kỹ năng thích ứng giúp tổ chức đối phó với thay đổi, còn kỹ năng giao","tiếp tập trung vào việc xây dựng lòng tin.","D.Kỹ năng thích ứng tập trung vào tương lai, còn kỹ năng giao tiếp giúp tổ chức nhìn nhận quá khứ."
"6","5","single","Diễn giải quan điểm của thuyết Y về sự tự giác và cam kết trong công việc của con người?","C","C.Con người chủ động và tự giác nếu họ cảm thấy cam kết với mục tiêu.","A.Con người cần bị ép buộc và giám sát để thực hiện công việc.","B.Sáng tạo và trách nhiệm chỉ xuất hiện ở một số ít người trong tổ chức.","C.Con người chủ động và tự giác nếu họ cảm thấy cam kết với mục tiêu.","D.Con người thường có xu hướng trốn tránh trách nhiệm và thích an phận."
"6","6","single","Chỉ ra sự khác biệt giữa ""nhân tố thúc đẩy"" và ""nhân tố duy trì"" theo lý thuyết của Herzberg, và chỉ ra yếu tố thuộc nhóm nhân tố thúc đấy?","C","C.Sự thăng tiến và sự thách thức trong công việc.","A.Môi trường làm việc và sự an toàn lao động.","B.Tiền lương và chính sách tổ chức.","C.Sự thăng tiến và sự thách thức trong công việc.","D.Điều kiện làm việc và kiểm soát nội bộ."
"6","7","single","Làm rõ việc tôn trọng nhân cách con người lại giữ vai trò quan trọng trong quản lý tổ chức?","B","B.Vì nhân cách con người là yếu tố cần được đối xử bình đẳng và tôn trọng.","A.Vì điều đó giúp đạt được mục tiêu tổ chức nhanh hơn.","B.Vì nhân cách con người là yếu tố cần được đối xử bình đẳng và tôn trọng.","C.Vì không tôn trọng nhân cách con người sẽ gây mâu thuẫn nội bộ.","D.Vì các biện pháp xúc phạm nhân cách thường dẫn đến sự phản kháng."
"6","8","single","Nhận diện một năng lực quan trọng của người lãnh đạo theo nghiên cứu của Warren Bennis?","B","B.Quản lý bằng uy tín","A.Quản lý bằng sự chú ý","B.Quản lý bằng uy tín","C.Quản lý bằng ý nghĩa","D.Quản lý bằng gương mẫu"
"6","9","single","Chỉ ra những phẩm chất cốt lõi giúp phân biệt một nhà lãnh đạo hiệu quả là gì?","B","B.Khả năng thích ứng với thay đổi và tính quyết đoán.","A.Khả năng giao phó toàn bộ trách nhiệm cho cấp dưới.","B.Khả năng thích ứng với thay đổi và tính quyết đoán.","C.Khả năng kiểm soát tuyệt đối nhóm làm việc.","D.Khả năng tránh căng thẳng và áp lực trong mọi tình huống."
"6","10","single","Giải thích vai trò của ""quản lý bằng sự chú ý"" trong việc tạo sự gắn kết đội nhóm là gì?","B","B.Kỹ năng truyền đạt mục tiêu và ý nghĩa công việc để tạo sự gắn kết.","A.Khả năng kiểm soát và điều hành nhóm từ xa.","B.Kỹ năng truyền đạt mục tiêu và ý nghĩa công việc để tạo sự gắn kết.","C.Khả năng sử dụng quyền lực để đạt mục tiêu nhanh chóng.","D.Kỹ năng xử lý xung đột giữa các thành viên trong nhóm."
"6","11","single","Làm rõ lý do vì sao việc thiếu tầm nhìn chiến lược là một trong những sai lầm nghiêm trọng của nhà lãnh đạo? A.Vì đánh giá nhân sự dựa trên cảm tính thay vì năng lực thực tế","C","rõ ràng","B.Vì khuyến khích sự tự do quá mức trong công việc, làm giảm sự kiểm soát","C.Vì không có khả năng xác định tầm nhìn dài hạn và định hướng tương lai","rõ ràng","D.Vì phụ thuộc quá nhiều vào cấp dưới trong việc ra quyết định chiến lược"
"6","12","single","Mô tả phong cách lãnh đạo phù hợp để quản lý nhân viên có năng lực nhưng thiếu động lực làm việc?","C","C.Tham gia và tăng cường hỗ trợ.","A.Giảng giải và làm rõ trách nhiệm.","B.Ra lệnh, chỉ đạo trực tiếp.","C.Tham gia và tăng cường hỗ trợ.","D.Giao phó toàn bộ công việc và quan sát."
"6","13","single","Giải thích lý do tại sao nhân viên ở mức độ sẵn sàng R1 cần phong cách lãnh đạo ra lệnh và giám sát chặt chẽ?","D","D.Ra lệnh và giám sát chặt chẽ.","A.Giao phó toàn bộ công việc và tự xử lý.","B.Tạo điều kiện và hướng dẫn nhẹ nhàng.","C.Tham gia và hỗ trợ trong các quyết định.","D.Ra lệnh và giám sát chặt chẽ."
"6","14","single","Với vai trò là quản lý trực tiếp của một tập thể nhân viên trẻ, thiếu kinh nghiệm và thường xuyên bị động trong công việc, Anh/Chị nên chọn phong cách lãnh đạo nào để chứng minh khả năng đạt hiệu quả tối ưu?","C","C.Lãnh đạo độc tài","A.Lãnh đạo dân chủ","B.Lãnh đạo tham gia","C.Lãnh đạo độc tài","D.Lãnh đạo tự do"
"6","15","single","Anh/Chị là trưởng phòng nhân sự. Một nhân viên có năng lực nhưng thường xuyên tỏ ra không hài lòng với điều kiện làm việc và chính sách công ty. Theo lý thuyết hai yếu tố của Frederich Herzberg, anh/chị nên áp dụng biện pháp nào để giải quyết vấn đề này?","B","B.Tăng lương và cải thiện điều kiện làm việc cho nhân viên","A.Không can thiệp vì vấn đề này không ảnh hưởng đến hiệu suất công việc","B.Tăng lương và cải thiện điều kiện làm việc cho nhân viên","C.Tăng cường động lực bằng cách giao thêm nhiệm vụ thách thức và có trách nhiệm cao hơn","D.Khuyến khích nhân viên tự đề xuất giải pháp cải thiện môi trường làm việc"
"6","16","single","Nhắc lại sự khác biệt chính giữa khái niệm lãnh đạo và quản lý? A.Lãnh đạo chỉ xảy ra trong các tổ chức chính thức.","D","D.Lãnh đạo là khái niệm rộng hơn, còn quản lý mang tính đặc thù về mục tiêu tổ chức","B.Lãnh đạo liên quan đến kế hoạch dài hạn, còn quản lý liên quan đến hành","động ngắn hạn.","C.Lãnh đạo tập trung vào tổ chức, còn quản lý tập trung vào con người.","D.Lãnh đạo là khái niệm rộng hơn, còn quản lý mang tính đặc thù về mục tiêu tổ chức"
"6","17","single","Chỉ ra đặc điểm nổi bật của nhu cầu tự thể hiện trong tháp nhu cầu của Maslow?","B","B.Mong muốn phát huy tối đa tiềm năng cá nhân.","A.Khát vọng đạt được sự công nhận từ cộng đồng.","B.Mong muốn phát huy tối đa tiềm năng cá nhân.","C.Nhu cầu cơ bản về ăn uống và an toàn.","D.Cần có mối quan hệ tốt trong cộng đồng làm việc."
"6","18","single","So sánh điều kiện cần thiết trong thuyết Y để con người phát huy trách nhiệm với các điều kiện khác?","C","C.Được giao nhiệm vụ rõ ràng kèm với cam kết mục tiêu.","A.Được giảm bớt khối lượng công việc.","B.Được tự do thực hiện mà không có bất kỳ quy tắc nào.","C.Được giao nhiệm vụ rõ ràng kèm với cam kết mục tiêu.","D.Bị kiểm tra và đánh giá thường xuyên từ bên ngoài."
